,sent,noun,adj,verb,others,label
185,"The undersigned hereby absolutely, unconditionally and irrevocably agrees as a Guarantor (as defined in the Registration Rights Agreement, dated as of November 30, 2009 by and among the Company, a Delaware corporation, and J.P. Morgan Securities Inc., on behalf of itself and the other Initial Purchasers) to be bound by the terms and provisions of such Registration Rights Agreement.  ",20,3,5,42,0
186,"Each Holder shall pay all underwriting discounts and commissions, brokerage commissions and transfer taxes, if any, relating to the sale or disposition of such Holder’s Registrable Securities pursuant to the Shelf Registration Statement.",16,2,4,16,0
187,Confirmed and accepted as of the date first above written:,2,0,2,7,0
188,"In consideration of the foregoing, the parties hereto agree as follows:",3,0,3,7,0
189,Exchange Securities” shall mean senior notes issued by the Company and guaranteed by any Guarantor under the Indenture containing terms identical to the Securities (except that the Exchange Securities will not be subject to restrictions on transfer or to any increase in annual interest rate for failure to comply with this Agreement) and to be offered to Holders of Securities in exchange for Securities pursuant to the Exchange Offer. ,23,5,10,35,0
190,"In connection with any Underwritten Offering permitted by Section 3, the Company and any ",5,0,1,10,0
191,"This REGISTRATION RIGHTS AGREEMENT dated November 30, 2009 (the “Agreement”) is entered into by and among Advanced Micro Devices, Inc., a Delaware corporation (the “Company”) and",14,0,3,21,0
192,"IN WITNESS WHEREOF, the parties have executed this Agreement as of the date first written above.",5,0,3,10,0
193,"The amount paid or payable by an Indemnified Person as a result of the losses, claims, damages and liabilities referred to in paragraph (d) above shall be deemed to include, subject to the limitations set forth above, any legal or other expenses reasonably incurred by such Indemnified Person in connection with any such action or claim.",17,6,8,33,0
194,Participation of Broker-Dealers in Exchange Offer.,5,0,0,4,0
195,"In the event that either the Exchange Offer is not completed or the Shelf Registration Statement, if required pursuant to Section 2(b)(i) or 2(b)(ii)",9,0,3,16,0
196,Annex A,2,0,0,0,0
197,"In light of the above, and notwithstanding the other provisions of this Agreement, the Company and any Guarantor agree to amend or supplement the Prospectus contained in the Exchange Offer Registration Statement for a period of up to 180 days after the last Exchange Date (as such period may be extended pursuant to Section 3(d) of this Agreement), in order to expedite or facilitate the disposition of any Exchange Securities by Participating Broker-Dealers consistent with the positions of the Staff recited in Section 4(a) above.",26,6,11,54,0
198,"Any such separate firm (x) for any Initial Purchaser, its affiliates, directors and officers and any control",7,2,0,13,0
199,“Shelf Effectiveness Period” shall have the meaning set forth in Section 2(b) hereof.,7,0,3,8,0
200,Counterpart to Registration Rights Agreement  ,4,0,0,2,0
201,"Exchange Offer Registration Statement” shall mean an exchange offer registration statement on Form S-4 (or, if applicable, on another appropriate form) and all amendments and supplements to such registration statement, in each case including the Prospectus contained therein or deemed a part thereof, all exhibits thereto and any document incorporated by reference therein.",21,4,6,30,0
202,"(v) notify counsel for the Initial Purchasers and, in the case of a Shelf Registration, notify each Holder of Registrable Securities and counsel for such Holders promptly and, if requested by any such Holder or counsel, confirm such advice in writing (1) when a Registration Statement has become effective, when any post-effective amendment thereto has been filed and becomes effective and when any amendment or ",20,8,10,39,0
203,"The Company and any Guarantor further agree that Participating Broker-Dealers shall be authorized to deliver such Prospectus (or, to the extent permitted by law, make available) during such period in connection with the resales contemplated by this Section 4.",12,3,8,24,0
204,1. Definitions.,1,0,0,3,0
205,"  IN WITNESS WHEREOF, the parties have executed this Agreement as of the date first written above.          ",5,0,3,12,0
206,/s/ Thomas Seifert,3,0,0,0,0
